filename,thread_date,domain,status,priority,key_facts,canonical_file,action_required,last_verified,notes
BrainEntry007.md,2026-04-11,FINANCIAL-SNAPSHOT,CANONICAL,1,"Master canonical reset as of April 11 2026. Supersedes ALL prior entries 001-006 on any conflict. Full bill table: $2,061.84/mo total. Full debt table: $36,328.54 total. Income: $2,400/mo baseline (4-Thursday). Discretionary: $338.16 before gas/food/transport (all UNCONFIRMED). Allstate: $253.95/mo (Toyota Sienna WAV). Project naming convention reset established. 4 YouTube channels created, all empty. Brand System rules canonical here.",FINANCIAL-SNAPSHOT.md,This entry IS the canonical financial snapshot — no further action on figures; push naming reset retroactively during vault build,2026-04-25,Override notice: if any entry conflicts with this one, this one wins
BrainEntry008.md,2026-03-19,YOUTUBE-CONTENT,ACTIVE,2,"YouTube strategy and workflow system. KEY CORRECTION: passive income framing rejected — reframe as 'systematic income.' Fully automated AI channels flagged as oversold and often demonetized. Two-Track Model: Track A (Kray Studios) = formulaic faceless shorts, 3-6 months to 1K subs realistic. Track B (BrayDonDon) = personal voice, long-form essays, heart-and-soul channel. Notion workspace built then deleted — all content extracted for Obsidian rebuild.",BRAINOS-SYSTEM.md,Rebuild Notion frameworks (Four-Line scripting, anchor video ideas, clip workflow) in Obsidian,2026-04-25,Companion to BrainEntry009 — both cover March 19 session; Entry 008 = workflow/tools, Entry 009 = creative voice; do not merge
BrainEntry009.md,2026-03-19,YOUTUBE-CONTENT,ACTIVE,1,"BrayDonDon channel identity canonical. Channel thesis: 'figuring out what it feels like to be young and trying to understand how the world actually works when the systems you live inside keep changing the rules.' The Gap = core content engine (gap between how systems are described and how they actually function). THREE ANCHOR VIDEOS: (1) GameStop Buy Button Moment, (2) Death of the Dollar Menu, (3) The Suburb That Went Gray. BRAYDEN-IDENTITY Extension A seeded here.",BRAYDEN-IDENTITY.md,Choose which anchor video goes first and name a date — single highest-leverage open question for YouTube track,2026-04-25,Companion to BrainEntry008; same March 19 session; Extension A (formative background, GameStop, creative identity) already integrated into BRAYDEN-IDENTITY this session
BE-20260424-BRAINOS-master-index-audit-redesign.md,2026-04-24,BRAINOS-SYSTEM,CANONICAL,1,"Master Index v2 schema defined this session. Google Sheets deprecated as Index home. Vault-native CSV confirmed as canonical. 10-column schema: filename, thread_date, domain, status, priority, key_facts, canonical_file, action_required, last_verified, notes. Legacy sheet migration = dedicated session (this compilation).",BRAINOS-SYSTEM.md,Migration complete as of April 25 2026 session — update status to COMPLETE,2026-04-25,This file defines the schema all Batch 1-7 rows follow
BE-20260425-BRAINOS-triage-shiftmind-founding.md,2026-04-25,BRAINOS-SYSTEM,ACTIVE,1,"BrainOS endgame declared this session. CommonGrounds concept born (April 25 2026): commercialized BrainOS R&D. Whisper transcription not yet installed. Python 3.14.4 confirmed. n8n deprioritized until daily note habit established. Brayden Identity Snapshot expanded with full household, financial structure, and role history.",ACTIVE-PROJECTS.md,Run first Whisper test; create COMMONGROUNDS-PROJECT.md; update all canonical files from this session,2026-04-25,Most recent thread in archive — this compilation session IS the action item
BE-20260423-BRAINOS-git-gdrive-sync-completed.md,2026-04-23,BRAINOS-SYSTEM,CANONICAL,1,"Git setup complete: github.com/Open-Source-Boots/BrainOS-Vault, 151 files, branch main, auto-commit 10min, auto-pull on boot. OGD Sync (richardxiong) active — empty-vault workaround required at first setup. SECURITY INCIDENT: PAT accidentally pasted in chat, immediately revoked, new token stored in Windows Credential Manager. Standing rules: never embed PAT in chat; never use Google Drive for Desktop alongside OGD Sync — they conflict.",BRAINOS-SYSTEM.md,Confirm Drive folder fully populated with all subfolders; delete empty Obsidian folder in Drive; install Local REST API plugin,2026-04-23,Continues from BE-20260422; Syncthing laptop↔desktop deprioritized — Git + Drive cover cross-device sync
BE-20260425-BRAINOS-architecture-sync-fixes.md,2026-04-25,BRAINOS-SYSTEM,ACTIVE,1,"Raw/Wiki/Output confirmed as cleaner mental model than Canonical/Brain-Entry/Outbox — folder structure unchanged, thinking model updated. Google Drive for Desktop replaces OGD Sync plugin — file moves now work correctly. MASTER-INDEX.csv machine-readable only — requires companion MASTER-INDEX.md with Dataview queries to display. iPhone GitHub PAT expires May 22 2026 — renew before that date. n8n deprioritized — no workflows until daily note habit + desktop Ollama running.",BRAINOS-SYSTEM.md,Create MASTER-INDEX.md Dataview dashboard; create 99-OUTBOX/ folder; create COMMONGROUNDS-PROJECT.md stub; rename legacy Google Sheet to MASTER-INDEX-LEGACY in Drive,2026-04-25,Predates this compilation session by hours — seed data drafted here was the 13-row precursor to today's full 48-row migration
BEUNASSIGNED_20260221_SKILL_peaslee-tech-career-path-eval.md,2026-02-21,SKILLS-EDUCATION,ACTIVE,2,"Earliest entry in archive — origin of electrician path. Peaslee Tech catalog analysis: Electrician 152hrs/$2,625; HVAC 150hrs/$2,650; Robotics 176hrs/$3,150. All KBOR approved. Electrician recommended as primary track; Robotics as Phase 2 post-credential. KS Journeyman avg ~$60,157/yr (web estimate — not confirmed offer). Phased path: Electrician → Apprenticeship → Robotics/PLC. Lawrence Workforce Center registration required for credentialed programs.",BRAYDEN-IDENTITY.md,Confirm HVAC silently eliminated as path — never documented; confirm Robotics internship availability with Peaslee directly,2026-04-25,Superseded in enrollment specifics by Brain_Entry_005; consistent with Entry 007 Track 5; peer referral (Charlie) came later — this was catalog-led research
BEUNASSIGNED_20260317_MIXED_capability-map-fabrication-correction.md,2026-03-17,AI-WORKFLOW-RULES,ACTIVE,1,"PRIMARY SOURCE for AI fabrication standing rule. CtrlYou capability map generated: local SEO $750-$1,500/mo retainer, 10 n8n workflows, 3-layer model (Human→AI→n8n→Output), Priority Stack Tier 1-4. Financial fabrication occurred mid-thread — AI invented rent, expenses, surplus, specific debt balances. Brayden caught it same session. Three rewritten Drive docs (Master Context v3, Cash Flow v3, Command Hub v3) contain fabricated figures — DO NOT USE. STANDING RULE ORIGIN: AI writes structure, Brayden fills numbers.",AI-WORKFLOW-RULES.md,Flag or delete 3 v3 Drive docs (DRAFT-CONTAINS-ERRORS); confirm GoodLife Fitness vs Innovations — RESOLVED: Innovations is canonical,2026-04-25,Same thread as BrainEntry006 — this entry is more structurally rigorous; during vault build declare one canonical and supersede the other; cross-reference Entry 006
BE_OpenSource_011.md,2026-04-05,BRAINOS-SYSTEM,SUPERSEDED,1,"Local AI stack origin thread. LM Studio 0.4.9 installed (1:44 AM Apr 5), Ollama downloaded (1:40 AM), Obsidian 1.12.7 installed (2:22 AM), LocalSend/Syncthing/Pinokio/Spacedesk all downloaded same overnight session. Gemma 3 1b running at 18.66 tok/sec on laptop. Spacedesk confirmed working as iPad second monitor. Desktop fully pending (Ryzen 7 7700X, RTX 3060 12GB, 64GB RAM). iPhone setup zero. iPad = Spacedesk only. LM Link flagged as future desktop↔laptop bridge (Tailscale encrypted). Naming convention rule: do not cement Kray Studios or Ctrl+You in canonical files yet.",DEVICE-ECOSYSTEM.md,Create DEVICE-ECOSYSTEM.md — this thread is the primary seed; confirm Ollama install completed (download confirmed, install unverified); install LM Studio on desktop when ready,2026-04-25,Same date range as BE-20260405-TOOL-local-ai-stack-device-ecosystem.md — these two entries overlap significantly; during vault build declare one canonical and cross-link or merge the other
BrainOS-Open-Questions-Worksheet.md,2026-04-17,BRAYDEN-IDENTITY,CANONICAL,1,"107-question archive-wide fact confirmation session. Key resolutions: GoodLife Innovations confirmed canonical (GoodLife Fitness = error). Samantha name confirmed. Gas ~$100/mo. Food ~$50/mo out of pocket. $88 bank balance Apr 17. v3 Drive docs deleted — irrelevant. HVAC path eliminated (undocumented). Zoho support@ confirmed. No NLRB/AFL-CIO contact made. No YouTube content uploaded. Comic holder printed but wall mount failed. P1S in bedroom (not garage). CRV repair ~$870 wheel bearings + rear brakes — FIMC reimbursement still pending. Foam sculpting = active hobby interest. Peaslee waitlist confirmed, payment still needed.",BRAYDEN-IDENTITY.md,Push all confirmed answers to canonical files — this worksheet IS the update source,2026-04-17,Answers as of April 17 2026; some answers contain important behavioral notes captured below
Brain_Entry_004.md,2026-03-17,ONLINE-BUSINESS,ACTIVE,2,"Ctrl+You full outreach asset suite generated: 15 DM templates (5 niches × 3 versions), 3 review request templates, client onboarding checklist, proof-of-work tracker, 30-target prospect list. None deployed. Honest barrier: confidence gap + life compression (Thu-Sat lockout). Site reset to Shopify default — deliberate pause pending brain compilation. Income confirmed: ~$600/Thursday, $2,400/mo baseline. CORRECTION: Entry 001 listed Baldwin City — Lawrence KS is correct.",ACTIVE-PROJECTS.md,Confirm outreach assets deleted from Drive (confirmed in Open Questions worksheet); no action until vault compilation complete,2026-04-10,Logged April 10 from March 17 thread — out of chronological order; companion to BEUNASSIGNED_20260317 which is more detailed; during vault build declare one canonical
Brain_Entry_005.md,2026-03-18,SKILLS-EDUCATION,CANONICAL,1,"Peaslee Tech in-person visit March 18 2026 — met Charlie who referred to Phyllis/Gingette at Lawrence Workforce Center. Waitlist joined same day: Order #4394, 9:34 AM, status Awaiting Payment. Program: Residential Electrician, Oct 27 2026 – Mar 11 2027, Tue/Thu 5-9 PM, $2,625 tuition. Funding strategy: WIOA voucher (primary) + RISE program + Housing Authority/Catholic Charities/DCF stack. June cohort full — October confirmed. Call script and objection-handling guide generated. Seat not secured until payment or authorized third-party voucher received.",BRAYDEN-IDENTITY.md,Call Phyllis/Gingette 785-840-9675 — WIOA voucher is the unlock; confirm payment or voucher before October to secure seat; pursue Peaslee Promise scholarship,2026-04-10,Supersedes BEUNASSIGNED_20260221 for enrollment specifics; consistent with Entry 007 Track 5; HVAC silently dropped — confirmed eliminated in Open Questions worksheet
Brain_Entry_010.md,2026-04-11,BRAINOS-SYSTEM,CANONICAL,1,"Full device ecosystem and open-source AI stack canonical reference. Desktop: Ryzen 7 7700X, RTX 3060 12GB, 64GB RAM — nothing installed yet. Laptop: Iris Xe, 8GB, partial setup (LM Studio + Obsidian + Syncthing confirmed). Gemma 3 1b running at 18.66 tok/sec on laptop CPU. Full model stack documented: Llama 3.3 8b / DeepSeek R1 14b / Qwen 2.5 Coder / Gemma 4 31B Claude Distill (18.7GB Q4_K_M, Apache 2.0). ComfyUI + Flux.1 for images. MusicGen for audio. KrayVault folder structure defined. Project naming convention established: GLWC use directly, all other brands use functional descriptors until launched.",DEVICE-ECOSYSTEM.md,Create DEVICE-ECOSYSTEM.md — this entry + BE_OpenSource_011 are co-equal seed sources; complete laptop remaining tasks in order (Ollama confirm → LocalSend → LibreOffice → HuggingFace → KrayVault → Smart Connections → Syncthing),2026-04-11,Overlaps significantly with BE_OpenSource_011.md — both cover April 5-11 device setup; during vault build treat Brain_Entry_010 as canonical and BE_OpenSource_011 as supplementary or merge them